{
  "version": 0,
  "architecture": "x86_64",
  "current_state": {
    "path": "boot_smoke_to_stack_memory_and_runtime_progression_to_halt",
    "halt_contract": "contracts/runtime_halt_contract.v0.json",
    "progression_contract": "contracts/runtime_progression_contract.v0.json",
    "progression_entry_contract": "contracts/runtime_progression_entry_contract.v0.json",
    "terminal_behavior": "halt_loop"
  },
  "stages": [
    {
      "stage_id": 0,
      "stage_name": "BOOT_SMOKE",
      "description": "QEMU serial smoke evidence reaches the governed boot smoke marker and remains under the runtime halt contract.",
      "status": "proven",
      "required_prerequisites": [],
      "required_evidence": [
        "artifacts/runtime/qemu_smoke.metadata.json",
        "artifacts/runtime/qemu_smoke.summary.txt",
        "artifacts/runtime/boot_blocker_report.json"
      ],
      "required_contracts": [
        "contracts/runtime_halt_contract.v0.json",
        "contracts/runtime_evidence_taxonomy.v0.json"
      ],
      "required_validators": [
        "qemu_smoke_evidence",
        "boot_blocker_report",
        "runtime_halt_contract",
        "runtime_evidence_taxonomy"
      ],
      "allowed_next_stages": [
        "STACK_INITIALIZATION_EVIDENCE"
      ],
      "forbidden_shortcuts": [
        "BOOT_SMOKE to MEMORY_INITIALIZATION_EVIDENCE",
        "BOOT_SMOKE to RUNTIME_PROGRESSION_ENTRY",
        "BOOT_SMOKE to FIRST_GOVERNED_RUNTIME_CAPABILITY",
        "BOOT_SMOKE to USERSPACE_PLANNING"
      ]
    },
    {
      "stage_id": 1,
      "stage_name": "STACK_INITIALIZATION_EVIDENCE",
      "description": "Evidence proves the controlled boot stack boundary before memory or runtime progression evidence.",
      "status": "proven",
      "required_prerequisites": [
        "BOOT_SMOKE"
      ],
      "required_evidence": [
        "QEMU evidence for KOZO_STACK_INIT_OK",
        "stack initialization metadata"
      ],
      "required_contracts": [
        "contracts/stack_initialization_evidence_contract.v0.json"
      ],
      "required_validators": [
        "stack_initialization_evidence_contract",
        "stack_initialization_evidence"
      ],
      "allowed_next_stages": [
        "MEMORY_INITIALIZATION_EVIDENCE"
      ],
      "forbidden_shortcuts": [
        "STACK_INITIALIZATION_EVIDENCE to RUNTIME_PROGRESSION_ENTRY",
        "STACK_INITIALIZATION_EVIDENCE to RUNTIME_INITIALIZATION_EVIDENCE",
        "STACK_INITIALIZATION_EVIDENCE to FIRST_GOVERNED_RUNTIME_CAPABILITY",
        "STACK_INITIALIZATION_EVIDENCE to USERSPACE_PLANNING"
      ]
    },
    {
      "stage_id": 2,
      "stage_name": "MEMORY_INITIALIZATION_EVIDENCE",
      "description": "Evidence proves the governed static memory initialization boundary after stack evidence.",
      "status": "proven",
      "required_prerequisites": [
        "STACK_INITIALIZATION_EVIDENCE"
      ],
      "required_evidence": [
        "QEMU evidence for KOZO_MEMORY_INIT_OK",
        "memory initialization metadata"
      ],
      "required_contracts": [
        "contracts/memory_initialization_evidence_contract.v0.json"
      ],
      "required_validators": [
        "memory_initialization_evidence_contract",
        "memory_initialization_evidence"
      ],
      "allowed_next_stages": [
        "RUNTIME_PROGRESSION_ENTRY"
      ],
      "forbidden_shortcuts": [
        "MEMORY_INITIALIZATION_EVIDENCE to RUNTIME_INITIALIZATION_EVIDENCE",
        "MEMORY_INITIALIZATION_EVIDENCE to FIRST_GOVERNED_RUNTIME_CAPABILITY",
        "MEMORY_INITIALIZATION_EVIDENCE to USERSPACE_PLANNING"
      ]
    },
    {
      "stage_id": 3,
      "stage_name": "RUNTIME_PROGRESSION_ENTRY",
      "description": "Hosted QEMU evidence proves assembly enters the bounded Odin runtime path after stack and memory evidence.",
      "status": "proven",
      "required_prerequisites": [
        "MEMORY_INITIALIZATION_EVIDENCE"
      ],
      "required_evidence": [
        "QEMU evidence for KOZO_RUNTIME_PROGRESS_ENTRY",
        "release evidence update"
      ],
      "required_contracts": [
        "contracts/runtime_halt_contract.v0.json",
        "contracts/runtime_progression_contract.v0.json",
        "contracts/runtime_progression_entry_contract.v0.json"
      ],
      "required_validators": [
        "runtime_progression_contract",
        "runtime_progression_entry_contract",
        "runtime_progression_evidence",
        "qemu_smoke_evidence"
      ],
      "allowed_next_stages": [
        "RUNTIME_INITIALIZATION_EVIDENCE"
      ],
      "forbidden_shortcuts": [
        "RUNTIME_PROGRESSION_ENTRY to CONTROLLED_RUNTIME_LOOP",
        "RUNTIME_PROGRESSION_ENTRY to FIRST_GOVERNED_RUNTIME_CAPABILITY",
        "RUNTIME_PROGRESSION_ENTRY to USERSPACE_PLANNING"
      ]
    },
    {
      "stage_id": 4,
      "stage_name": "RUNTIME_INITIALIZATION_EVIDENCE",
      "description": "Hosted QEMU evidence proves Odin validates the bootstrap context, completes the bounded volatile runtime-state probe, and returns through the governed continuation.",
      "status": "proven",
      "required_prerequisites": [
        "RUNTIME_PROGRESSION_ENTRY"
      ],
      "required_evidence": [
        "QEMU evidence for KOZO_RUNTIME_INIT_OK",
        "QEMU evidence for KOZO_RUNTIME_RETURN_OK"
      ],
      "required_contracts": [
        "contracts/runtime_progression_entry_contract.v0.json"
      ],
      "required_validators": [
        "runtime_progression_evidence"
      ],
      "allowed_next_stages": [
        "CONTROLLED_RUNTIME_LOOP"
      ],
      "forbidden_shortcuts": [
        "RUNTIME_INITIALIZATION_EVIDENCE to FIRST_GOVERNED_RUNTIME_CAPABILITY",
        "RUNTIME_INITIALIZATION_EVIDENCE to USERSPACE_PLANNING"
      ]
    },
    {
      "stage_id": 5,
      "stage_name": "CONTROLLED_RUNTIME_LOOP",
      "description": "Hosted QEMU evidence proves the bounded three-iteration Odin loop completed after runtime initialization and before the governed capability boundary.",
      "status": "proven",
      "required_prerequisites": [
        "RUNTIME_INITIALIZATION_EVIDENCE"
      ],
      "required_evidence": [
        "QEMU evidence through KOZO_RUNTIME_LOOP_EXIT_OK",
        "kernel ELF evidence for a backward branch in controlled_runtime_loop",
        "release evidence update"
      ],
      "required_contracts": [
        "contracts/controlled_runtime_loop_contract.v0.json"
      ],
      "required_validators": [
        "controlled_runtime_loop_contract",
        "controlled_runtime_loop_evidence"
      ],
      "allowed_next_stages": [
        "FIRST_GOVERNED_RUNTIME_CAPABILITY"
      ],
      "forbidden_shortcuts": [
        "CONTROLLED_RUNTIME_LOOP to USERSPACE_PLANNING"
      ]
    },
    {
      "stage_id": 6,
      "stage_name": "FIRST_GOVERNED_RUNTIME_CAPABILITY",
      "description": "A bounded internal runtime status query is implemented after the accepted controlled loop; hosted evidence remains pending.",
      "status": "implemented_pending_ci",
      "required_prerequisites": [
        "CONTROLLED_RUNTIME_LOOP"
      ],
      "required_evidence": [
        "QEMU evidence for first governed runtime capability",
        "release evidence update"
      ],
      "required_contracts": [
        "contracts/first_governed_runtime_capability.v0.json"
      ],
      "required_validators": [
        "first_governed_runtime_capability",
        "first_governed_runtime_capability_evidence"
      ],
      "allowed_next_stages": [
        "USERSPACE_PLANNING"
      ],
      "forbidden_shortcuts": [
        "FIRST_GOVERNED_RUNTIME_CAPABILITY to userspace implementation"
      ]
    },
    {
      "stage_id": 7,
      "stage_name": "USERSPACE_PLANNING",
      "description": "Governance-defined planning boundary for one fixed supervisor-owned user execution context around the accepted one-shot Ring3 transaction; runtime implementation remains unauthorized.",
      "status": "planned",
      "required_prerequisites": [
        "FIRST_GOVERNED_RUNTIME_CAPABILITY"
      ],
      "required_evidence": [
        "userspace planning evidence",
        "fixed user execution context governance prerequisites"
      ],
      "required_contracts": [
        "contracts/fixed_user_execution_context_contract.v0.json"
      ],
      "required_validators": [
        "planned:fixed_user_execution_context_evidence"
      ],
      "allowed_next_stages": [],
      "forbidden_shortcuts": [
        "USERSPACE_PLANNING to userspace execution without separate implementation evidence",
        "USERSPACE_PLANNING to repeated user sessions",
        "USERSPACE_PLANNING to process or scheduler behavior"
      ]
    }
  ],
  "transitions": [
    {
      "from_stage": "BOOT_SMOKE",
      "to_stage": "STACK_INITIALIZATION_EVIDENCE",
      "owner_contract": "contracts/stack_initialization_evidence_contract.v0.json"
    },
    {
      "from_stage": "STACK_INITIALIZATION_EVIDENCE",
      "to_stage": "MEMORY_INITIALIZATION_EVIDENCE",
      "owner_contract": "contracts/memory_initialization_evidence_contract.v0.json"
    },
    {
      "from_stage": "MEMORY_INITIALIZATION_EVIDENCE",
      "to_stage": "RUNTIME_PROGRESSION_ENTRY",
      "owner_contract": "contracts/runtime_progression_entry_contract.v0.json"
    },
    {
      "from_stage": "RUNTIME_PROGRESSION_ENTRY",
      "to_stage": "RUNTIME_INITIALIZATION_EVIDENCE",
      "owner_contract": "contracts/runtime_progression_entry_contract.v0.json"
    },
    {
      "from_stage": "RUNTIME_INITIALIZATION_EVIDENCE",
      "to_stage": "CONTROLLED_RUNTIME_LOOP",
      "owner_contract": "contracts/controlled_runtime_loop_contract.v0.json"
    },
    {
      "from_stage": "CONTROLLED_RUNTIME_LOOP",
      "to_stage": "FIRST_GOVERNED_RUNTIME_CAPABILITY",
      "owner_contract": "contracts/first_governed_runtime_capability.v0.json"
    },
    {
      "from_stage": "FIRST_GOVERNED_RUNTIME_CAPABILITY",
      "to_stage": "USERSPACE_PLANNING",